{
  "schema_version": 1,
  "kind": "comparison_suite",
  "title": "TraceWhy full diagnostic casebook",
  "description": "Six native Linux comparisons demonstrate every TraceWhy v1 diagnostic capability with linked trace evidence.",
  "generated_at": "2026-07-13T12:07:41.628Z",
  "cases": [
    {
      "case_id": "missing-config",
      "label": "Missing configuration",
      "description": "A worker opens the same configuration path successfully in the good run and receives ENOENT in the bad run.",
      "capabilities": [
        "file_access"
      ],
      "comparison": {
        "schema_version": 1,
        "tracewhy_version": "1.0.0",
        "comparison_id": "comparison-08c331564c630705",
        "created_at": "2026-07-13T12:07:40.429Z",
        "good": {
          "name": "good",
          "command": "./.build/media-worker",
          "args": [
            "--config",
            "worker.toml"
          ],
          "cwd": "/workspace/demos/missing-config",
          "exit": {
            "code": 0,
            "success": true
          },
          "system": {
            "platform": "linux",
            "kernel": "Linux 6.12.76-linuxkit",
            "architecture": "aarch64",
            "distribution": "Debian GNU/Linux 12 (bookworm)",
            "libc": "ldd (Debian GLIBC 2.36-9+deb12u14) 2.36"
          },
          "warnings": []
        },
        "bad": {
          "name": "bad",
          "command": "./.build/media-worker",
          "args": [
            "--config",
            "worker.toml"
          ],
          "cwd": "/workspace/demos/missing-config",
          "exit": {
            "code": 78,
            "success": false
          },
          "system": {
            "platform": "linux",
            "kernel": "Linux 6.12.76-linuxkit",
            "architecture": "aarch64",
            "distribution": "Debian GNU/Linux 12 (bookworm)",
            "libc": "ldd (Debian GLIBC 2.36-9+deb12u14) 2.36"
          },
          "warnings": []
        },
        "findings": [
          {
            "finding_id": "missing_file:-PROJECT-worker.toml-p2",
            "type": "missing_file",
            "title": "File or directory is missing: worker.toml",
            "classification": "likely_cause",
            "confidence": "high",
            "score": 95,
            "summary": "openat succeeds for `$PROJECT/worker.toml` in the good run but returns ENOENT in the bad run.",
            "reasons": [
              "The operation succeeds in the good run and fails in the bad run.",
              "The bad run returned ENOENT.",
              "The resource is referenced in captured error output."
            ],
            "good_event_ids": [
              "good:15"
            ],
            "bad_event_ids": [
              "bad:15"
            ]
          },
          {
            "finding_id": "child_process_failure:p2",
            "type": "child_process_failure",
            "title": "Child process p2 exits differently",
            "classification": "likely_cause",
            "confidence": "high",
            "score": 75,
            "summary": "The good child exits with code 0; the bad child exits with code 78.",
            "reasons": [
              "An aligned child process exits differently between runs.",
              "The difference is attached directly to the failing child."
            ],
            "good_event_ids": [
              "good:17"
            ],
            "bad_event_ids": [
              "bad:16"
            ]
          }
        ],
        "events": {
          "good": [
            {
              "schema_version": 1,
              "event_id": "good:1",
              "process_id": "p1",
              "sequence": 1,
              "category": "executable",
              "operation": "execve",
              "resource": "$PROJECT/.build/media-worker",
              "result": {
                "kind": "success",
                "value": "0"
              },
              "details": {
                "path_was_relative": true
              },
              "raw_ref": {
                "file": "trace.45",
                "line": 1
              }
            },
            {
              "schema_version": 1,
              "event_id": "good:2",
              "process_id": "p1",
              "sequence": 2,
              "category": "library",
              "operation": "faccessat",
              "resource": "/etc/ld.so.preload",
              "result": {
                "kind": "error",
                "code": "ENOENT"
              },
              "details": {
                "dirfd": "AT_FDCWD"
              },
              "raw_ref": {
                "file": "trace.45",
                "line": 2
              }
            },
            {
              "schema_version": 1,
              "event_id": "good:3",
              "process_id": "p1",
              "sequence": 3,
              "category": "library",
              "operation": "openat",
              "resource": "/etc/ld.so.cache",
              "result": {
                "kind": "success",
                "value": "3"
              },
              "details": {
                "dirfd": "AT_FDCWD"
              },
              "raw_ref": {
                "file": "trace.45",
                "line": 3
              }
            },
            {
              "schema_version": 1,
              "event_id": "good:4",
              "process_id": "p1",
              "sequence": 4,
              "category": "library",
              "operation": "newfstatat",
              "resource": "/etc/ld.so.cache",
              "result": {
                "kind": "success",
                "value": "0"
              },
              "details": {
                "dirfd": "3",
                "path_was_relative": true
              },
              "raw_ref": {
                "file": "trace.45",
                "line": 4
              }
            },
            {
              "schema_version": 1,
              "event_id": "good:5",
              "process_id": "p1",
              "sequence": 5,
              "category": "library",
              "operation": "openat",
              "resource": "/lib/aarch64-linux-gnu/libc.so.6",
              "result": {
                "kind": "success",
                "value": "3"
              },
              "details": {
                "dirfd": "AT_FDCWD"
              },
              "raw_ref": {
                "file": "trace.45",
                "line": 5
              }
            },
            {
              "schema_version": 1,
              "event_id": "good:6",
              "process_id": "p1",
              "sequence": 6,
              "category": "library",
              "operation": "newfstatat",
              "resource": "/lib/aarch64-linux-gnu/libc.so.6",
              "result": {
                "kind": "success",
                "value": "0"
              },
              "details": {
                "dirfd": "3",
                "path_was_relative": true
              },
              "raw_ref": {
                "file": "trace.45",
                "line": 6
              }
            },
            {
              "schema_version": 1,
              "event_id": "good:7",
              "process_id": "p1",
              "sequence": 7,
              "category": "process",
              "operation": "clone",
              "result": {
                "kind": "success",
                "value": "p2"
              },
              "details": {
                "child_pid": "p2"
              },
              "raw_ref": {
                "file": "trace.45",
                "line": 7
              }
            },
            {
              "schema_version": 1,
              "event_id": "good:8",
              "process_id": "p1",
              "sequence": 8,
              "category": "process",
              "operation": "wait4",
              "result": {
                "kind": "success",
                "value": "p2"
              },
              "raw_ref": {
                "file": "trace.45",
                "line": 8
              }
            },
            {
              "schema_version": 1,
              "event_id": "good:9",
              "process_id": "p2",
              "parent_process_id": "p1",
              "sequence": 9,
              "category": "executable",
              "operation": "execve",
              "resource": "$PROJECT/.build/config-preflight",
              "result": {
                "kind": "success",
                "value": "0"
              },
              "details": {
                "path_was_relative": true
              },
              "raw_ref": {
                "file": "trace.46",
                "line": 1
              }
            },
            {
              "schema_version": 1,
              "event_id": "good:10",
              "process_id": "p2",
              "parent_process_id": "p1",
              "sequence": 10,
              "category": "library",
              "operation": "faccessat",
              "resource": "/etc/ld.so.preload",
              "result": {
                "kind": "error",
                "code": "ENOENT"
              },
              "details": {
                "dirfd": "AT_FDCWD"
              },
              "raw_ref": {
                "file": "trace.46",
                "line": 2
              }
            },
            {
              "schema_version": 1,
              "event_id": "good:11",
              "process_id": "p2",
              "parent_process_id": "p1",
              "sequence": 11,
              "category": "library",
              "operation": "openat",
              "resource": "/etc/ld.so.cache",
              "result": {
                "kind": "success",
                "value": "3"
              },
              "details": {
                "dirfd": "AT_FDCWD"
              },
              "raw_ref": {
                "file": "trace.46",
                "line": 3